{"source":"PLACEHOLDER conformance stub (NOT the authentic Titan Ghost engine)","authentic":false,"mode":"SIMULATION","allocations":[{"marketId":"currencies","allocation":{"mode":"SIMULATION","capitalUsd":5000,"deployedUsd":2500,"idleUsd":2500,"dailyEarnUsd":2.1,"yieldBpsOnDeployed":8.4,"rings":[{"id":"VELOCITY","allocUsd":2500,"dailyEarnUsd":2.1,"marginalBps":3.2,"utilization":0.12}]}}],"recommendations":[{"source":"Wake/CFIE/DMSIE (demo adapter)","action":"reallocate","fromMarket":"securities","toMarket":"currencies","amountUsd":1000,"rationale":"Illustrative: higher marginal yield in currencies.","mode":"SIMULATION"}]}
